{
  "$schema": "https://json-schema.org/draft/2020-12/schema",
  "$id": "ECTOS_GENERIC_WORKSPACE_IDENTITY_CONTRACT_V02_SCHEMA",
  "type": "object",
  "additionalProperties": false,
  "required": [
    "contract_id", "version", "status", "scope", "schema_path",
    "member_selection_model", "member_selection_baseline", "materialization_contract",
    "materialization_evidence_schema", "supported_os", "supported_runtime_classes",
    "raw_byte_source", "required_workspace_eol", "normalization_during_hash",
    "blob_substitution_as_workspace_evidence", "currentness_rule",
    "materialization_evidence_required_fields", "worktree_byte_identity_rule",
    "qualification_binding", "mission_registry_binding", "rollback_boundary"
  ],
  "properties": {
    "contract_id": {"const": "ECTOS_GENERIC_WORKSPACE_IDENTITY_CONTRACT_V02"},
    "version": {"const": "V02"},
    "status": {"const": "CURRENT_CANDIDATE"},
    "scope": {"const": "CROSS_PLATFORM_GOVERNED_WORKSPACE_BYTE_IDENTITY"},
    "schema_path": {"type": "string", "minLength": 1},
    "member_selection_model": {"type": "string", "minLength": 1},
    "member_selection_baseline": {"type": "string", "minLength": 1},
    "materialization_contract": {"type": "string", "minLength": 1},
    "materialization_evidence_schema": {"type": "string", "minLength": 1},
    "supported_os": {"type": "array", "minItems": 1, "items": {"type": "string"}},
    "supported_runtime_classes": {"type": "array", "minItems": 1, "items": {"type": "string"}},
    "raw_byte_source": {"const": "RAW_BYTES_FROM_MATERIALIZED_WORKSPACE_FILE"},
    "required_workspace_eol": {"const": "LF_FOR_SELECTED_TEXT_MEMBERS"},
    "normalization_during_hash": {"const": "PROHIBITED"},
    "blob_substitution_as_workspace_evidence": {"const": "PROHIBITED"},
    "currentness_rule": {"type": "object"},
    "materialization_evidence_required_fields": {"type": "array", "minItems": 1, "items": {"type": "string"}},
    "worktree_byte_identity_rule": {"type": "object"},
    "qualification_binding": {"type": "object"},
    "mission_registry_binding": {"type": "object"},
    "rollback_boundary": {"type": "object"}
  }
}
